Chapter,Chapter_Title,Scripture_Ref,Scripture_Text,Theme,Testimony_Notes,Chapter_Draft,Book_Visual_Prompt,Short_Video_Prompt,Long_Video_Prompt,Voiceover_Caption,Status,Asset_Base_Name,Target_Visual_File
CH11,The Hospital Stay: God Was in the Room,Psalm 41:3,The LORD will strengthen him upon the bed of languishing.,Presence in Sickness,The hospital stay - God present through illness. (Expand.),(to be written - see 01 Manuscript folder),"Cinematic, premium faith-based book illustration for 'This Is How You Walk on Water' - Chapter 11: The Hospital Stay: God Was in the Room. Scene: a hospital room transfigured by warm divine presence; light at the bedside; angelic peace. Mood: God's presence in sickness. Style: Heavenly Hands Divine - water motif, divine golden light, deep jewel tones (navy, teal, gold), tasteful, hopeful, fine-art testimony illustration. Feature Loretta 'Lolo' Hall's likeness (Higgsfield Soul 'Coral Elegance Unveiled') as the woman. Vertical 2:3, high resolution, no text, no watermark.","15-30s vertical reel (9:16). HOOK (0-3s): ""In the hospital room, God was there."" VISUALS: a hospital room transfigured by warm divine presence; light at the bedside; angelic peace; slow cinematic push-in, water and golden light, soft particles. TONE: Faith Over Fear - intimate, uplifting. Optional captions. END CARD: 'This Is How You Walk on Water - Chapter 11'.",60-90s testimony teaser (9:16). ARC: open in the weight of God's presence in sickness; move through the moment (a hospital room transfigured by warm divine presence; light at the bedside; angelic peace); resolve into hope and light. Loretta 'Lolo' Hall voiceover over soft cinematic b-roll of water and golden light; subtle scripture overlay; build to the turning point. CTA: 'Read Chapter 11 of This Is How You Walk on Water.',"Warm, intimate, faith-filled - Loretta 'Lolo' Hall. Pace: slow, tender, hopeful. SEED LINE: ""On the days the machines beeped and the nights felt long, God never left the room."" ~120-150 words (long) / ~30 words (reel). End with a gentle invitation to keep walking in faith. CAPTION: ""In the hospital room, God was there."" - from Chapter 11 of This Is How You Walk on Water. #FaithOverFear #WalkOnWater #HeavenlyHandsDivine",Not Started,Hospital_Stay_God_Was_in_the_Room,WOWBOOK_CH11_Hospital_Stay_God_Was_in_the_Room_V1_Draft.png
CH12,"Still Living With Rods: 39 Bolts, 39 Stripes",Isaiah 53:5,...and with his stripes we are healed.,Pain & Healing,"Living with rods - 39 bolts, 39 stripes; redemptive healing. (Expand.) [CH12 update: Rods shifted — a medical scare — but testing showed they were stable.]",(to be written - see 01 Manuscript folder),"Cinematic, premium faith-based book illustration for 'This Is How You Walk on Water' - Chapter 12: Still Living With Rods: 39 Bolts, 39 Stripes. Scene: a luminous silhouette with rods of golden light along the spine, 39 points of light, echoing Isaiah 53. Mood: pain redeemed into healing. Style: Heavenly Hands Divine - water motif, divine golden light, deep jewel tones (navy, teal, gold), tasteful, hopeful, fine-art testimony illustration. Feature Loretta 'Lolo' Hall's likeness (Higgsfield Soul 'Coral Elegance Unveiled') as the woman. Vertical 2:3, high resolution, no text, no watermark.","15-30s vertical reel (9:16). HOOK (0-3s): ""39 bolts in my back - by His 39 stripes I am healed."" VISUALS: a luminous silhouette with rods of golden light along the spine, 39 points of light, echoing Isaiah 53; slow cinematic push-in, water and golden light, soft particles. TONE: Faith Over Fear - intimate, uplifting. Optional captions. END CARD: 'This Is How You Walk on Water - Chapter 12'.","60-90s testimony teaser (9:16). ARC: open in the weight of pain redeemed into healing; move through the moment (a luminous silhouette with rods of golden light along the spine, 39 points of light, echoing Isaiah 53); resolve into hope and light. Loretta 'Lolo' Hall voiceover over soft cinematic b-roll of water and golden light; subtle scripture overlay; build to the turning point. CTA: 'Read Chapter 12 of This Is How You Walk on Water.'","Warm, intimate, faith-filled - Loretta 'Lolo' Hall. Pace: slow, tender, hopeful. SEED LINE: ""I still live with rods, but by His stripes I am healed."" ~120-150 words (long) / ~30 words (reel). End with a gentle invitation to keep walking in faith. CAPTION: ""39 bolts in my back - by His 39 stripes I am healed."" - from Chapter 12 of This Is How You Walk on Water. #FaithOverFear #WalkOnWater #HeavenlyHandsDivine",Not Started,Still_Living_With_Rods_39_Bolts_39_Stripes,WOWBOOK_CH12_Still_Living_With_Rods_39_Bolts_39_Stripes_V1_Draft.png
CH13,The Four Nodules Diagnosis: Whose Report Will You Believe?,Isaiah 53:1,Who hath believed our report? and to whom is the arm of the LORD revealed?,Faith over the Report,Four nodules diagnosis; choosing God's report. (Expand.),(to be written - see 01 Manuscript folder),"Cinematic, premium faith-based book illustration for 'This Is How You Walk on Water' - Chapter 13: The Four Nodules Diagnosis: Whose Report Will You Believe?. Scene: a medical report dissolving into light as a woman chooses faith; scripture overpowering a diagnosis. Mood: faith over the report. Style: Heavenly Hands Divine - water motif, divine golden light, deep jewel tones (navy, teal, gold), tasteful, hopeful, fine-art testimony illustration. Feature Loretta 'Lolo' Hall's likeness (Higgsfield Soul 'Coral Elegance Unveiled') as the woman. Vertical 2:3, high resolution, no text, no watermark.","15-30s vertical reel (9:16). HOOK (0-3s): ""Whose report will you believe? I believe the report of the Lord."" VISUALS: a medical report dissolving into light as a woman chooses faith; scripture overpowering a diagnosis; slow cinematic push-in, water and golden light, soft particles. TONE: Faith Over Fear - intimate, uplifting. Optional captions. END CARD: 'This Is How You Walk on Water - Chapter 13'.",60-90s testimony teaser (9:16). ARC: open in the weight of faith over the report; move through the moment (a medical report dissolving into light as a woman chooses faith; scripture overpowering a diagnosis); resolve into hope and light. Loretta 'Lolo' Hall voiceover over soft cinematic b-roll of water and golden light; subtle scripture overlay; build to the turning point. CTA: 'Read Chapter 13 of This Is How You Walk on Water.',"Warm, intimate, faith-filled - Loretta 'Lolo' Hall. Pace: slow, tender, hopeful. SEED LINE: ""The doctors gave a report - but I chose to believe the report of the Lord."" ~120-150 words (long) / ~30 words (reel). End with a gentle invitation to keep walking in faith. CAPTION: ""Whose report will you believe? I believe the report of the Lord."" - from Chapter 13 of This Is How You Walk on Water. #FaithOverFear #WalkOnWater #HeavenlyHandsDivine",Not Started,Four_Nodules_Whose_Report_Will_You_Believe,WOWBOOK_CH13_Four_Nodules_Whose_Report_Will_You_Believe_V1_Draft.png
CH14,The Water Did Not Drown Me,Isaiah 43:2,"When thou passest through the waters, I will be with thee.",Survival & Deliverance,Passing through deep waters and not drowning. (Expand.),(to be written - see 01 Manuscript folder),"Cinematic, premium faith-based book illustration for 'This Is How You Walk on Water' - Chapter 14: The Water Did Not Drown Me. Scene: a woman rising up out of deep waters into light, not drowning but ascending. Mood: survival and deliverance. Style: Heavenly Hands Divine - water motif, divine golden light, deep jewel tones (navy, teal, gold), tasteful, hopeful, fine-art testimony illustration. Feature Loretta 'Lolo' Hall's likeness (Higgsfield Soul 'Coral Elegance Unveiled') as the woman. Vertical 2:3, high resolution, no text, no watermark.","15-30s vertical reel (9:16). HOOK (0-3s): ""The water did not drown me."" VISUALS: a woman rising up out of deep waters into light, not drowning but ascending; slow cinematic push-in, water and golden light, soft particles. TONE: Faith Over Fear - intimate, uplifting. Optional captions. END CARD: 'This Is How You Walk on Water - Chapter 14'.","60-90s testimony teaser (9:16). ARC: open in the weight of survival and deliverance; move through the moment (a woman rising up out of deep waters into light, not drowning but ascending); resolve into hope and light. Loretta 'Lolo' Hall voiceover over soft cinematic b-roll of water and golden light; subtle scripture overlay; build to the turning point. CTA: 'Read Chapter 14 of This Is How You Walk on Water.'","Warm, intimate, faith-filled - Loretta 'Lolo' Hall. Pace: slow, tender, hopeful. SEED LINE: ""The waters that should have buried me became the place I learned to rise."" ~120-150 words (long) / ~30 words (reel). End with a gentle invitation to keep walking in faith. CAPTION: ""The water did not drown me."" - from Chapter 14 of This Is How You Walk on Water. #FaithOverFear #WalkOnWater #HeavenlyHandsDivine",Not Started,The_Water_Did_Not_Drown_Me,WOWBOOK_CH14_The_Water_Did_Not_Drown_Me_V1_Draft.png
CH15,The Dove Experiences: God Came Like a Dove,Matthew 3:16,"...the Spirit of God descending like a dove, and lighting upon him.",Peace & the Spirit,The dove experiences - the Spirit's gentle visitation. (Expand.),(to be written - see 01 Manuscript folder),"Cinematic, premium faith-based book illustration for 'This Is How You Walk on Water' - Chapter 15: The Dove Experiences: God Came Like a Dove. Scene: a radiant white dove descending in golden light over still water. Mood: peace and the Spirit's visitation. Style: Heavenly Hands Divine - water motif, divine golden light, deep jewel tones (navy, teal, gold), tasteful, hopeful, fine-art testimony illustration. Vertical 2:3, high resolution, no text, no watermark.","15-30s vertical reel (9:16). HOOK (0-3s): ""God came to me like a dove."" VISUALS: a radiant white dove descending in golden light over still water; slow cinematic push-in, water and golden light, soft particles. TONE: Faith Over Fear - intimate, uplifting. Optional captions. END CARD: 'This Is How You Walk on Water - Chapter 15'.",60-90s testimony teaser (9:16). ARC: open in the weight of peace and the Spirit's visitation; move through the moment (a radiant white dove descending in golden light over still water); resolve into hope and light. Loretta 'Lolo' Hall voiceover over soft cinematic b-roll of water and golden light; subtle scripture overlay; build to the turning point. CTA: 'Read Chapter 15 of This Is How You Walk on Water.',"Warm, intimate, faith-filled - Loretta 'Lolo' Hall. Pace: slow, tender, hopeful. SEED LINE: ""When I needed peace, God came to me gentle as a dove."" ~120-150 words (long) / ~30 words (reel). End with a gentle invitation to keep walking in faith. CAPTION: ""God came to me like a dove."" - from Chapter 15 of This Is How You Walk on Water. #FaithOverFear #WalkOnWater #HeavenlyHandsDivine",Not Started,Dove_Experiences_God_Came_Like_a_Dove,WOWBOOK_CH15_Dove_Experiences_God_Came_Like_a_Dove_V1_Draft.png
CH16,The Giraffe Revelation: Seeing Higher,Colossians 3:2,"Set your affection on things above, not on things on the earth.",Vision & Perspective,The giraffe revelation - seeing higher. (Expand.),(to be written - see 01 Manuscript folder),"Cinematic, premium faith-based book illustration for 'This Is How You Walk on Water' - Chapter 16: The Giraffe Revelation: Seeing Higher. Scene: a giraffe silhouette against dawn, eyes lifted high above the plain. Mood: elevated perspective and revelation. Style: Heavenly Hands Divine - water motif, divine golden light, deep jewel tones (navy, teal, gold), tasteful, hopeful, fine-art testimony illustration. Vertical 2:3, high resolution, no text, no watermark.","15-30s vertical reel (9:16). HOOK (0-3s): ""God taught me to see higher."" VISUALS: a giraffe silhouette against dawn, eyes lifted high above the plain; slow cinematic push-in, water and golden light, soft particles. TONE: Faith Over Fear - intimate, uplifting. Optional captions. END CARD: 'This Is How You Walk on Water - Chapter 16'.","60-90s testimony teaser (9:16). ARC: open in the weight of elevated perspective and revelation; move through the moment (a giraffe silhouette against dawn, eyes lifted high above the plain); resolve into hope and light. Loretta 'Lolo' Hall voiceover over soft cinematic b-roll of water and golden light; subtle scripture overlay; build to the turning point. CTA: 'Read Chapter 16 of This Is How You Walk on Water.'","Warm, intimate, faith-filled - Loretta 'Lolo' Hall. Pace: slow, tender, hopeful. SEED LINE: ""God lifted my eyes to see what fear had hidden below."" ~120-150 words (long) / ~30 words (reel). End with a gentle invitation to keep walking in faith. CAPTION: ""God taught me to see higher."" - from Chapter 16 of This Is How You Walk on Water. #FaithOverFear #WalkOnWater #HeavenlyHandsDivine",Not Started,Giraffe_Revelation_Seeing_Higher,WOWBOOK_CH16_Giraffe_Revelation_Seeing_Higher_V1_Draft.png
CH17,Small Animals in the Kitchen: God Speaks in Strange Places,1 Kings 19:12,...and after the fire a still small voice.,God in the Ordinary,"God speaking in unexpected, ordinary places. (Expand.)",(to be written - see 01 Manuscript folder),"Cinematic, premium faith-based book illustration for 'This Is How You Walk on Water' - Chapter 17: Small Animals in the Kitchen: God Speaks in Strange Places. Scene: an ordinary kitchen touched with subtle wonder and warm light; the sacred in the mundane. Mood: God in the ordinary. Style: Heavenly Hands Divine - water motif, divine golden light, deep jewel tones (navy, teal, gold), tasteful, hopeful, fine-art testimony illustration. Vertical 2:3, high resolution, no text, no watermark.","15-30s vertical reel (9:16). HOOK (0-3s): ""God speaks even in strange and ordinary places."" VISUALS: an ordinary kitchen touched with subtle wonder and warm light; the sacred in the mundane; slow cinematic push-in, water and golden light, soft particles. TONE: Faith Over Fear - intimate, uplifting. Optional captions. END CARD: 'This Is How You Walk on Water - Chapter 17'.",60-90s testimony teaser (9:16). ARC: open in the weight of God in the ordinary; move through the moment (an ordinary kitchen touched with subtle wonder and warm light; the sacred in the mundane); resolve into hope and light. Loretta 'Lolo' Hall voiceover over soft cinematic b-roll of water and golden light; subtle scripture overlay; build to the turning point. CTA: 'Read Chapter 17 of This Is How You Walk on Water.',"Warm, intimate, faith-filled - Loretta 'Lolo' Hall. Pace: slow, tender, hopeful. SEED LINE: ""God taught me to listen, because He speaks even in the kitchen."" ~120-150 words (long) / ~30 words (reel). End with a gentle invitation to keep walking in faith. CAPTION: ""God speaks even in strange and ordinary places."" - from Chapter 17 of This Is How You Walk on Water. #FaithOverFear #WalkOnWater #HeavenlyHandsDivine",Not Started,Small_Animals_in_the_Kitchen,WOWBOOK_CH17_Small_Animals_in_the_Kitchen_V1_Draft.png
CH18,Daniel 10: The Battle for Delayed Blessings,Daniel 10:12,"...from the first day... thy words were heard, and I am come for thy words.",Spiritual Warfare / Delay,Daniel 10 - the battle behind delayed blessings. (Expand.),(to be written - see 01 Manuscript folder),"Cinematic, premium faith-based book illustration for 'This Is How You Walk on Water' - Chapter 18: Daniel 10: The Battle for Delayed Blessings. Scene: an angel breaking through dark storm clouds with an answer of light after a long battle. Mood: perseverance and unseen warfare. Style: Heavenly Hands Divine - water motif, divine golden light, deep jewel tones (navy, teal, gold), tasteful, hopeful, fine-art testimony illustration. Vertical 2:3, high resolution, no text, no watermark.","15-30s vertical reel (9:16). HOOK (0-3s): ""Your blessing was delayed, not denied."" VISUALS: an angel breaking through dark storm clouds with an answer of light after a long battle; slow cinematic push-in, water and golden light, soft particles. TONE: Faith Over Fear - intimate, uplifting. Optional captions. END CARD: 'This Is How You Walk on Water - Chapter 18'.",60-90s testimony teaser (9:16). ARC: open in the weight of perseverance and unseen warfare; move through the moment (an angel breaking through dark storm clouds with an answer of light after a long battle); resolve into hope and light. Loretta 'Lolo' Hall voiceover over soft cinematic b-roll of water and golden light; subtle scripture overlay; build to the turning point. CTA: 'Read Chapter 18 of This Is How You Walk on Water.',"Warm, intimate, faith-filled - Loretta 'Lolo' Hall. Pace: slow, tender, hopeful. SEED LINE: ""For twenty-one days heaven fought for me - the answer was on its way the whole time."" ~120-150 words (long) / ~30 words (reel). End with a gentle invitation to keep walking in faith. CAPTION: ""Your blessing was delayed, not denied."" - from Chapter 18 of This Is How You Walk on Water. #FaithOverFear #WalkOnWater #HeavenlyHandsDivine",Not Started,Daniel_10_Battle_for_Delayed_Blessings,WOWBOOK_CH18_Daniel_10_Battle_for_Delayed_Blessings_V1_Draft.png
CH19,It's Just a Shadow,Psalm 27:1,The LORD is my light and my salvation; whom shall I fear?,Fearlessness,Fear exposed as just a shadow. (Expand.),(to be written - see 01 Manuscript folder),"Cinematic, premium faith-based book illustration for 'This Is How You Walk on Water' - Chapter 19: It's Just a Shadow. Scene: a looming shadow revealed to be small against a great light; fear shrinking before faith. Mood: fearlessness. Style: Heavenly Hands Divine - water motif, divine golden light, deep jewel tones (navy, teal, gold), tasteful, hopeful, fine-art testimony illustration. Feature Loretta 'Lolo' Hall's likeness (Higgsfield Soul 'Coral Elegance Unveiled') as the woman. Vertical 2:3, high resolution, no text, no watermark.","15-30s vertical reel (9:16). HOOK (0-3s): ""It looked like a giant - it was just a shadow."" VISUALS: a looming shadow revealed to be small against a great light; fear shrinking before faith; slow cinematic push-in, water and golden light, soft particles. TONE: Faith Over Fear - intimate, uplifting. Optional captions. END CARD: 'This Is How You Walk on Water - Chapter 19'.",60-90s testimony teaser (9:16). ARC: open in the weight of fearlessness; move through the moment (a looming shadow revealed to be small against a great light; fear shrinking before faith); resolve into hope and light. Loretta 'Lolo' Hall voiceover over soft cinematic b-roll of water and golden light; subtle scripture overlay; build to the turning point. CTA: 'Read Chapter 19 of This Is How You Walk on Water.',"Warm, intimate, faith-filled - Loretta 'Lolo' Hall. Pace: slow, tender, hopeful. SEED LINE: ""What loomed like a giant was only a shadow in the light of God."" ~120-150 words (long) / ~30 words (reel). End with a gentle invitation to keep walking in faith. CAPTION: ""It looked like a giant - it was just a shadow."" - from Chapter 19 of This Is How You Walk on Water. #FaithOverFear #WalkOnWater #HeavenlyHandsDivine",Not Started,Its_Just_a_Shadow,WOWBOOK_CH19_Its_Just_a_Shadow_V1_Draft.png
CH20,This Time the Enemy Will Not Steal,Joel 2:25,And I will restore to you the years that the locust hath eaten.,Recovery & Authority,Reclaiming what the enemy tried to steal. (Expand.),(to be written - see 01 Manuscript folder),"Cinematic, premium faith-based book illustration for 'This Is How You Walk on Water' - Chapter 20: This Time the Enemy Will Not Steal. Scene: hands reclaiming stolen treasure wrapped in light; a gate closing on the thief. Mood: recovery and authority. Style: Heavenly Hands Divine - water motif, divine golden light, deep jewel tones (navy, teal, gold), tasteful, hopeful, fine-art testimony illustration. Feature Loretta 'Lolo' Hall's likeness (Higgsfield Soul 'Coral Elegance Unveiled') as the woman. Vertical 2:3, high resolution, no text, no watermark.","15-30s vertical reel (9:16). HOOK (0-3s): ""This time, the enemy will not steal."" VISUALS: hands reclaiming stolen treasure wrapped in light; a gate closing on the thief; slow cinematic push-in, water and golden light, soft particles. TONE: Faith Over Fear - intimate, uplifting. Optional captions. END CARD: 'This Is How You Walk on Water - Chapter 20'.",60-90s testimony teaser (9:16). ARC: open in the weight of recovery and authority; move through the moment (hands reclaiming stolen treasure wrapped in light; a gate closing on the thief); resolve into hope and light. Loretta 'Lolo' Hall voiceover over soft cinematic b-roll of water and golden light; subtle scripture overlay; build to the turning point. CTA: 'Read Chapter 20 of This Is How You Walk on Water.',"Warm, intimate, faith-filled - Loretta 'Lolo' Hall. Pace: slow, tender, hopeful. SEED LINE: ""I took back, in Jesus' name, everything the enemy tried to steal."" ~120-150 words (long) / ~30 words (reel). End with a gentle invitation to keep walking in faith. CAPTION: ""This time, the enemy will not steal."" - from Chapter 20 of This Is How You Walk on Water. #FaithOverFear #WalkOnWater #HeavenlyHandsDivine",Not Started,This_Time_the_Enemy_Will_Not_Steal,WOWBOOK_CH20_This_Time_the_Enemy_Will_Not_Steal_V1_Draft.png
CH21,The Tomb Has Been Rolled Away: I Will Rise,Matthew 28:2,...the angel... came and rolled back the stone from the door.,Resurrection,Resurrected dreams; the stone rolled away. (Expand.),(to be written - see 01 Manuscript folder),"Cinematic, premium faith-based book illustration for 'This Is How You Walk on Water' - Chapter 21: The Tomb Has Been Rolled Away: I Will Rise. Scene: an empty tomb with the stone rolled aside and brilliant resurrection light bursting out. Mood: resurrection and rising. Style: Heavenly Hands Divine - water motif, divine golden light, deep jewel tones (navy, teal, gold), tasteful, hopeful, fine-art testimony illustration. Feature Loretta 'Lolo' Hall's likeness (Higgsfield Soul 'Coral Elegance Unveiled') as the woman. Vertical 2:3, high resolution, no text, no watermark.","15-30s vertical reel (9:16). HOOK (0-3s): ""The stone is rolled away - I will rise."" VISUALS: an empty tomb with the stone rolled aside and brilliant resurrection light bursting out; slow cinematic push-in, water and golden light, soft particles. TONE: Faith Over Fear - intimate, uplifting. Optional captions. END CARD: 'This Is How You Walk on Water - Chapter 21'.",60-90s testimony teaser (9:16). ARC: open in the weight of resurrection and rising; move through the moment (an empty tomb with the stone rolled aside and brilliant resurrection light bursting out); resolve into hope and light. Loretta 'Lolo' Hall voiceover over soft cinematic b-roll of water and golden light; subtle scripture overlay; build to the turning point. CTA: 'Read Chapter 21 of This Is How You Walk on Water.',"Warm, intimate, faith-filled - Loretta 'Lolo' Hall. Pace: slow, tender, hopeful. SEED LINE: ""What I buried in grief, God called out of the grave."" ~120-150 words (long) / ~30 words (reel). End with a gentle invitation to keep walking in faith. CAPTION: ""The stone is rolled away - I will rise."" - from Chapter 21 of This Is How You Walk on Water. #FaithOverFear #WalkOnWater #HeavenlyHandsDivine",Not Started,Tomb_Has_Been_Rolled_Away_I_Will_Rise,WOWBOOK_CH21_Tomb_Has_Been_Rolled_Away_I_Will_Rise_V1_Draft.png
CH22,Dry Bones Rattling: It Is Finished,Ezekiel 37:5,"Behold, I will cause breath to enter into you, and ye shall live.",Revival / Finished Work,Dry bones living again; it is finished. (Expand.),(to be written - see 01 Manuscript folder),"Cinematic, premium faith-based book illustration for 'This Is How You Walk on Water' - Chapter 22: Dry Bones Rattling: It Is Finished. Scene: a valley of dry bones coming alive with the breath of golden light. Mood: revival and the finished work. Style: Heavenly Hands Divine - water motif, divine golden light, deep jewel tones (navy, teal, gold), tasteful, hopeful, fine-art testimony illustration. Vertical 2:3, high resolution, no text, no watermark.","15-30s vertical reel (9:16). HOOK (0-3s): ""Dry bones are rattling - it is finished."" VISUALS: a valley of dry bones coming alive with the breath of golden light; slow cinematic push-in, water and golden light, soft particles. TONE: Faith Over Fear - intimate, uplifting. Optional captions. END CARD: 'This Is How You Walk on Water - Chapter 22'.",60-90s testimony teaser (9:16). ARC: open in the weight of revival and the finished work; move through the moment (a valley of dry bones coming alive with the breath of golden light); resolve into hope and light. Loretta 'Lolo' Hall voiceover over soft cinematic b-roll of water and golden light; subtle scripture overlay; build to the turning point. CTA: 'Read Chapter 22 of This Is How You Walk on Water.',"Warm, intimate, faith-filled - Loretta 'Lolo' Hall. Pace: slow, tender, hopeful. SEED LINE: ""God breathed, and what was dead in me began to live again."" ~120-150 words (long) / ~30 words (reel). End with a gentle invitation to keep walking in faith. CAPTION: ""Dry bones are rattling - it is finished."" - from Chapter 22 of This Is How You Walk on Water. #FaithOverFear #WalkOnWater #HeavenlyHandsDivine",Not Started,Dry_Bones_Rattling_It_Is_Finished,WOWBOOK_CH22_Dry_Bones_Rattling_It_Is_Finished_V1_Draft.png
